{
  "entries": [
    {
      "bytes": 5072,
      "kind": "public-derived-source",
      "notes": "Curated public RPM metadata excerpt preserving real nginx, nginx-core, and nginx-filesystem package metadata.",
      "path": "tests/fixtures/rpm-primary.xml",
      "refreshedAt": "2026-06-17",
      "sha256": "25c0adda39d1d43dc0f3b5d1f56eb2df39ff79335247ef1a926c9b1d82f20071",
      "source": "AlmaLinux 9 AppStream x86_64 primary.xml.gz excerpt",
      "sourceUrl": "https://repo.almalinux.org/almalinux/9/AppStream/x86_64/os/"
    },
    {
      "bytes": 4060,
      "derivedFrom": [
        "tests/fixtures/rpm-primary.xml"
      ],
      "kind": "deterministic-public-derived-variant",
      "notes": "Companion snapshot used to exercise repository diff behavior.",
      "path": "tests/fixtures/rpm-primary-updated.xml",
      "refreshedAt": "2026-06-17",
      "sha256": "928e73e59484433c7ee9b5fd6e3de006e914b3e289261eeef4d792f34f90569a",
      "source": "AlmaLinux 9 AppStream x86_64 primary.xml.gz excerpt",
      "sourceUrl": "https://repo.almalinux.org/almalinux/9/AppStream/x86_64/os/"
    },
    {
      "bytes": 178,
      "derivedFrom": [
        "tests/fixtures/rpm-primary.xml"
      ],
      "kind": "local-pointer-fixture",
      "notes": "Keeps repodata discovery tests offline and deterministic.",
      "path": "tests/fixtures/repodata/repomd.xml",
      "refreshedAt": "2026-06-17",
      "sha256": "ffc395971b29a6ab6126c161cffc83f5a80d9675d170eb44a379f19973e5fc35",
      "source": "Local repomd.xml pointer for the committed primary excerpt",
      "sourceUrl": "https://repo.almalinux.org/almalinux/9/AppStream/x86_64/os/"
    },
    {
      "bytes": 3730,
      "kind": "public-derived-source",
      "notes": "Compact excerpt preserving real build ID, artifacts, build tasks, sign tasks, and package names.",
      "path": "tests/fixtures/albs-build.json",
      "refreshedAt": "2026-06-17",
      "sha256": "bd5a95f02a3afa9316f089b60d9789b0d56a0c9220885e266a5d0b896730880c",
      "source": "Public ALBS build 17812 API excerpt",
      "sourceUrl": "https://build.almalinux.org/api/v1/builds/17812/"
    },
    {
      "bytes": 3682,
      "derivedFrom": [
        "tests/fixtures/albs-build.json"
      ],
      "kind": "deterministic-public-derived-variant",
      "notes": "Companion snapshot used for build diff and release coverage tests.",
      "path": "tests/fixtures/albs-build-updated.json",
      "refreshedAt": "2026-06-17",
      "sha256": "eeebb4d28fa6844dfa672b07068fa8eec0eb3832087889ca06aa06d38ed7039d",
      "source": "Public ALBS build 17812 API excerpt",
      "sourceUrl": "https://build.almalinux.org/api/v1/builds/17812/"
    },
    {
      "bytes": 2610,
      "derivedFrom": [
        "tests/fixtures/rpm-primary.xml"
      ],
      "generator": "scripts/generate_public_fixture_reports.py",
      "kind": "generated-public-report",
      "path": "tests/fixtures/rpm-repository-summary.json",
      "reportSchema": "edgp.rpm.repository_summary.v1",
      "sha256": "0f694aad93cdb0ae767086712925faeee6c798004abd6fa8e626ab45759ceb3f"
    },
    {
      "bytes": 5198,
      "derivedFrom": [
        "tests/fixtures/rpm-primary.xml",
        "tests/fixtures/rpm-primary-updated.xml"
      ],
      "generator": "scripts/generate_public_fixture_reports.py",
      "kind": "generated-public-report",
      "path": "tests/fixtures/rpm-repository-diff.json",
      "reportSchema": "edgp.rpm.repository_diff.v1",
      "sha256": "e5c70b366a1c7498bceef8c316d565150748edc1f5fff8e2844c7afe39eb919f"
    },
    {
      "bytes": 3205,
      "derivedFrom": [
        "tests/fixtures/albs-build.json"
      ],
      "generator": "scripts/generate_public_fixture_reports.py",
      "kind": "generated-public-report",
      "path": "tests/fixtures/albs-artifact-inventory.json",
      "reportSchema": "edgp.albs.artifact_inventory.v1",
      "sha256": "2fd5b03d552325efeca1f41dccd01fddeee4b82912dc8f7d471488eb38739421"
    },
    {
      "bytes": 3411,
      "derivedFrom": [
        "tests/fixtures/albs-build.json"
      ],
      "generator": "scripts/generate_public_fixture_reports.py",
      "kind": "generated-public-report",
      "path": "tests/fixtures/albs-build-timing.json",
      "reportSchema": "edgp.albs.build_timing.v1",
      "sha256": "15c8489af82e0cfff0b3dfe0763aab1939b0628b11d05469cace7cf6ae43abc8"
    },
    {
      "bytes": 12446,
      "derivedFrom": [
        "tests/fixtures/albs-build.json",
        "tests/fixtures/albs-build-updated.json"
      ],
      "generator": "scripts/generate_public_fixture_reports.py",
      "kind": "generated-public-report",
      "path": "tests/fixtures/albs-build-diff.json",
      "reportSchema": "edgp.albs.build_diff.v1",
      "sha256": "617d2deceb5d866e4ac18a0e9f41493ccfde31e7a062e5239a16b77543c93df8"
    },
    {
      "bytes": 892,
      "derivedFrom": [
        "tests/fixtures/albs-build-updated.json"
      ],
      "generator": "scripts/generate_public_fixture_reports.py",
      "kind": "generated-public-report",
      "path": "tests/fixtures/albs-log-intelligence.json",
      "reportSchema": "edgp.albs.log_intelligence.v1",
      "sha256": "44978ee7026649f86bbefa466b748b1167502e5347015a12c8a6c60b03f7cd20"
    },
    {
      "bytes": 1374,
      "derivedFrom": [
        "tests/fixtures/albs-build.json",
        "tests/fixtures/albs-build-updated.json"
      ],
      "generator": "scripts/generate_public_fixture_reports.py",
      "kind": "generated-public-report",
      "path": "tests/fixtures/albs-release-completeness.json",
      "reportSchema": "edgp.albs.release_completeness.v1",
      "sha256": "0ae41d420fd4a049b05571716a76080b1c8c1a8e8e5e8749f0e990fa2d884cd2"
    },
    {
      "bytes": 1192,
      "derivedFrom": [
        "tests/fixtures/albs-build.json"
      ],
      "generator": "scripts/generate_public_fixture_reports.py",
      "kind": "generated-public-report",
      "notes": "Joins a tiny installed RPM graph to the public ALBS artifact excerpt.",
      "path": "tests/fixtures/rpm-albs-provenance.json",
      "reportSchema": "edgp.rpm.albs_provenance.v1",
      "sha256": "7161fb08865bbecbcd26b29aaa5e88a010b33798ae80db254095a00e239d4d49"
    },
    {
      "bytes": 3740,
      "derivedFrom": [
        "tests/fixtures/libsolv-transaction.txt"
      ],
      "generator": "scripts/generate_public_fixture_reports.py",
      "kind": "generated-public-report",
      "path": "tests/fixtures/libsolv-bridge.json",
      "reportSchema": "edgp.libsolv.bridge.v1",
      "sha256": "3746a15364ce8776767158f0a24e525e3166a707a9340cdc0a97ba80e1a6a35a"
    },
    {
      "bytes": 16347,
      "derivedFrom": [
        "tests/fixtures/fixture-provenance.json"
      ],
      "generator": "scripts/generate_public_fixture_reports.py",
      "kind": "generated-public-report",
      "notes": "Summarizes which committed fixtures are public-derived, generated, or intentionally synthetic.",
      "path": "tests/fixtures/real-data-coverage.json",
      "reportSchema": "edgp.real_data.coverage.v1",
      "sha256": "256b52b53c1c537da69d3296551874943da81e70c9724eb8809d5dc5fcb04513"
    },
    {
      "bytes": 1242,
      "derivedFrom": [
        "tests/fixtures/real-data-coverage.json"
      ],
      "generator": "scripts/generate_public_fixture_reports.py",
      "kind": "generated-public-report",
      "notes": "No-regression baseline for comparing public evidence coverage between two fixture snapshots.",
      "path": "tests/fixtures/real-data-coverage-diff.json",
      "reportSchema": "edgp.real_data.coverage_diff.v1",
      "sha256": "a38121117dea23c3b2d041b4d690ad8cbfa5115a171156e6faf8671b9abae441"
    }
  ],
  "fixtureRoot": "tests/fixtures",
  "generatedBy": "scripts/generate_fixture_provenance.py",
  "refresh": {
    "checkCommands": [
      "python -B scripts/generate_public_fixture_reports.py --check",
      "python -B scripts/generate_fixture_provenance.py --check"
    ],
    "checkedBy": [
      "tests/test_public_fixture_freshness.py",
      "tests/test_fixture_provenance.py"
    ],
    "commands": [
      "python -B scripts/generate_public_fixture_reports.py",
      "python -B scripts/generate_fixture_provenance.py"
    ]
  },
  "schema": "edgp.fixture.provenance.v1",
  "sourceUrls": [
    {
      "access": "public",
      "label": "AlmaLinux 9 AppStream x86_64 repository metadata",
      "refreshedAt": "2026-06-17",
      "url": "https://repo.almalinux.org/almalinux/9/AppStream/x86_64/os/"
    },
    {
      "access": "public",
      "label": "AlmaLinux Build System build 17812 API",
      "refreshedAt": "2026-06-17",
      "url": "https://build.almalinux.org/api/v1/builds/17812/"
    }
  ],
  "summary": {
    "catalogedFiles": 85,
    "deterministicPublicDerivedVariants": 2,
    "generatedPublicReports": 11,
    "publicDerivedSources": 2,
    "sourceUrls": 2,
    "syntheticGroups": 8
  },
  "syntheticGroups": [
    {
      "fileCount": 3,
      "files": [
        "tests/fixtures/package-lock.json",
        "tests/fixtures/package-lock-conflict.json",
        "tests/fixtures/registry.json"
      ],
      "group": "npm lockfiles and registry mock",
      "kind": "synthetic-edge-case",
      "reason": "Small lockfile topologies make duplicate and conflict assertions auditable.",
      "sha256": "7ad741ef23c0e249e8996b2fddff0dbc098fcd24a36a141fca81d4c4c5c113b4"
    },
    {
      "fileCount": 2,
      "files": [
        "tests/fixtures/poetry.lock",
        "tests/fixtures/Cargo.lock"
      ],
      "group": "Python and Rust lockfiles",
      "kind": "synthetic-edge-case",
      "reason": "Parser smoke inputs cover additional ecosystem formats offline.",
      "sha256": "341d2c88dc051829cb2ce0f6c2b15bce748de8f7ef12c0a19ec97f4cb55e85c1"
    },
    {
      "fileCount": 4,
      "files": [
        "tests/fixtures/maven-tree.txt",
        "tests/fixtures/maven-tree-classifier.txt",
        "tests/fixtures/maven-tree-markers.txt",
        "tests/fixtures/maven-tree-packaging.txt"
      ],